_id,name,image,description,__v
64344860b4a92de07f4dfffc,Sri Lankan,https://cdn.shopify.com/s/files/1/1762/3971/files/food.jpg?v=1655439679&width=3840,"Sri Lankan cuisine is a unique blend of South Indian, Middle Eastern, and colonial European influences, resulting in a delicious and spicy fusion of flavors. Staples include rice and curry, often accompanied by lentils, coconut sambal, and pickles. Spices like cinnamon, cardamom, and cumin are commonly used, creating a memorable culinary experience.",0
6434489cb4a92de07f4dfffe,Indian,https://media.istockphoto.com/id/922783734/photo/assorted-indian-recipes-food-various.jpg?s=612x612&w=0&k=20&c=p8DepvymWfC5j7c6En2UsQ6sUM794SQMwceeBW3yQ9M=,"Indian cuisine is a diverse and vibrant amalgamation of regional flavors and cooking techniques. It ranges from richly spiced meat dishes like butter chicken to vegetarian delights like chana masala and paneer tikka. Bread like naan and rice are common staples, with spices like turmeric, cumin, and coriander adding depth and complexity to each dish.",0
643448dab4a92de07f4e0000,French,https://media.istockphoto.com/id/587815190/photo/italian-antipasti-wine-snacks-set-over-black-grunge-background.jpg?s=612x612&w=0&k=20&c=fmy7Ft1tORZihL4BK2ZGsKCwJIc-R4hv-VzljOMMUCE=,"French cuisine is renowned for its exquisite flavors and elegant presentation. It features a wide range of dishes, from classic staples like escargots and coq au vin to more modern creations. French cuisine emphasizes the use of fresh, high-quality ingredients, and traditional techniques like braising, roasting, and sautéing. Bread, cheese, and wine are integral parts of the French culinary experience.",0
6434490cb4a92de07f4e0002,Chinese,https://media.istockphoto.com/id/545286388/photo/chinese-food-blank-background.jpg?s=612x612&w=0&k=20&c=pqOIy07YKO5PlU5VxjscwTGRrrZ8PluKMUjSOz-II60=,"Chinese cuisine is a diverse and richly flavored culinary tradition that varies by region. Staples like rice, noodles, and dumplings are served alongside stir-fried meats and vegetables, soups, and steamed buns. Chinese cuisine features a balance of sweet, sour, salty, and savory flavors, often incorporating ingredients like ginger, soy sauce, and sesame oil.",0
6434495ab4a92de07f4e0004,Japanese,https://media.istockphoto.com/id/917919440/photo/japanese-food.jpg?b=1&s=612x612&w=0&k=20&c=MgqB0W0-eUkEr7Gt1F2lb1nMJ6G3ko914his7_kwzOc=,"Japanese cuisine is characterized by its emphasis on fresh, seasonal ingredients and delicate flavors. Staples include rice, noodles, and seafood, with dishes like sushi and tempura gaining popularity worldwide. Japanese cuisine features a wide range of cooking techniques, from grilling to simmering, and often incorporates ingredients like miso, soy sauce, and mirin.",0
643449c2b4a92de07f4e0006,Thai,https://www.savoredjourneys.com/wp-content/uploads/2021/11/thai-food.jpg,"Thai cuisine is a flavorful and aromatic blend of sweet, sour, spicy, and salty tastes. It features staples like rice, noodles, and seafood, with dishes like pad thai, green curry, and tom yum soup becoming popular worldwide. Thai cuisine incorporates herbs like lemongrass and kaffir lime, as well as spices like chili, ginger, and coriander, to create a unique and unforgettable culinary experience.",0
643449e8b4a92de07f4e0008,American,https://d2lswn7b0fl4u2.cloudfront.net/photos/pg-american-dishes-1652886459.jpg,"American cuisine is a melting pot of diverse regional flavors and culinary traditions. It features staples like burgers, fries, and fried chicken, alongside dishes like macaroni and cheese, barbecue, and clam chowder. American cuisine often emphasizes bold flavors and hearty portions, with ingredients like bacon, cheese, and hot sauce being common favorites.",0
64344a12b4a92de07f4e000a,Greek,https://images.squarespace-cdn.com/content/v1/5e484ab628c78d6f7e602d73/c185f22e-bfed-4486-bb0b-749b8491a69d/traditional-greek-dishes.jpg,"Greek cuisine is a fresh and flavorful fusion of Mediterranean flavors and ingredients. Staples include grilled meats like souvlaki, fresh seafood, and a variety of salads and dips like tzatziki and hummus. Greek cuisine also features signature herbs like oregano and mint, as well as healthy ingredients like olive oil and feta cheese.",0
